{
  "id": "WRI-8fcbf558-18-T2",
  "testId": "WRI-8fcbf558-18",
  "taskNumber": 2,
  "taskType": "TASK_2_ESSAY",
  "prompt": "Task 2: Today, many people want to get married and have children in their thirties rather than when they are younger. Is it a positive or negative development? Write at least 250 words.",
  "wordRequirement": 250,
  "visual": {
    "type": "NONE",
    "tableData": null,
    "imagePath": null
  },
  "sourceEvidence": {
    "sourceFile": "/Users/arunyagoojar/Downloads/ielts-website/ielts-writing-test-18/index.html",
    "sourceHash": "8fcbf5580c64b1cb70d2757dbf2b95acf52820b943de34d1a8183ea10d395508"
  },
  "status": "VERIFIED"
}