{
  "id": "WRI-4f311e47-18-T2",
  "testId": "WRI-4f311e47-18",
  "taskNumber": 2,
  "taskType": "TASK_2_ESSAY",
  "prompt": "Task 2 : Some say that the most important thing about being rich is that one has the opportunity to help others. To what extent do you agree or disagree? Write at least 250 words.",
  "wordRequirement": 250,
  "visual": {
    "type": "NONE",
    "tableData": null,
    "imagePath": null
  },
  "sourceEvidence": {
    "sourceFile": "/Users/arunyagoojar/Downloads/ielts-website/ielts-writing-test-10/index.html",
    "sourceHash": "4f311e47211ddbe418df1591befb0d89c2cf1024ca3752d78c8936984d2c6b36"
  },
  "status": "VERIFIED"
}