{
  "id": "WRI-4930de65-18-T1",
  "testId": "WRI-4930de65-18",
  "taskNumber": 1,
  "taskType": "TASK_1_TABLE",
  "prompt": "Task 1: The table below presents the number of children ever born to women aged 40-44 years in Australia for each year the information was collected since 1981. Summarise the information by selecting and reporting the main features, and make comparisons where relevant. Write at least 150 words.",
  "wordRequirement": 150,
  "visual": {
    "type": "TABLE",
    "tableData": {
      "title": "",
      "headers": [
        "Year",
        "None %",
        "One child %",
        "Two children %",
        "Three children %",
        "Four or more children %"
      ],
      "rows": [
        [
          "2006",
          "15.9",
          "13.2",
          "38.3",
          "21.5",
          "11.0"
        ],
        [
          "1996",
          "12.8",
          "11.3",
          "38.2",
          "24.6",
          "13.1"
        ],
        [
          "1986",
          "9.7",
          "8.7",
          "35.6",
          "27.0",
          "18.9"
        ],
        [
          "1981",
          "8.5",
          "7.6",
          "29.0",
          "27.4",
          "27.6"
        ]
      ]
    },
    "imagePath": null
  },
  "sourceEvidence": {
    "sourceFile": "/Users/arunyagoojar/Downloads/ielts-website/ielts-writing-test-25/index.html",
    "sourceHash": "4930de65a96289c49f73d56e37e982f649539cddbe63fca400e931b36f0dd05f"
  },
  "status": "VERIFIED"
}